{"$schema":"https://json-schema.org/draft/2020-12/schema","additionalProperties":false,"properties":{"base":{"$ref":"#/$defs/revision"},"build":{"type":"object"},"executable":{"$ref":"#/$defs/file"},"patch":{"$ref":"#/$defs/file"},"retained_artifact":{"type":"string"},"schema_version":{"const":"openttd-rl-v2-m16-cargo-source-1"},"source":{"additionalProperties":false,"properties":{"commit":{"$ref":"#/$defs/sha1"},"path":{"type":"string"},"tree":{"$ref":"#/$defs/sha1"}},"required":["path","commit","tree"],"type":"object"}},"required":["schema_version","retained_artifact","base","source","patch","build","executable"],"type":"object","$defs":{"file":{"additionalProperties":true,"properties":{"path":{"type":"string"},"sha256":{"$ref":"#/$defs/sha256"}},"required":["path","sha256"],"type":"object"},"revision":{"additionalProperties":false,"properties":{"commit":{"$ref":"#/$defs/sha1"},"tree":{"$ref":"#/$defs/sha1"}},"required":["commit","tree"],"type":"object"},"sha1":{"pattern":"^[0-9a-f]{40}$","type":"string"},"sha256":{"pattern":"^[0-9a-f]{64}$","type":"string"}}}
