{"base":{"commit":"abc1912e290d8f49221fb3f68e30f3bcb3190ec9","tree":"fb9a95a7bb03f279a2965516713afd759010a46b"},"build":{"cmake_arguments":["-G","Ninja","-DCMAKE_BUILD_TYPE=RelWithDebInfo","-DOPTION_RL_ENVIRONMENT=ON","-DOPTION_RL_NEURAL_AGENT=OFF","-DOPTION_USE_ASSERTS=ON"],"open_gfx":{"path":"/home/thecl/.codex/artifacts/openttd-rl/v2-m16-cargo-a/build/baseset/opengfx-8.0.tar","sha256":"9389bcb0807058c80bd95121e978f05d9ef86b4b1bc3ac2da8da8bb02456043c"}},"executable":{"bytes":404236776,"path":"/home/thecl/.codex/artifacts/openttd-rl/v2-m16-cargo-a/build/openttd","sha256":"12ed1f2bb66fa5b2358259c5ff06c185e5a3aef2b24082dc7ad51c621d65cb5f"},"patch":{"path":"integration/openttd/patches/15.3/m16/cargo/0001-Add-native-V2-cargo-and-industry-qualification.patch","sha256":"cad6059cf04263d3ab19b8583221a94f65baa25e4dde4ab5bf3aae2fe5c5b44a"},"retained_artifact":"/home/thecl/.codex/artifacts/openttd-rl/v2-m16-cargo-a","schema_version":"openttd-rl-v2-m16-cargo-source-1","source":{"commit":"ceb913106af64d6a1a9c50afb15bf4437297363b","path":"/home/thecl/.codex/artifacts/openttd-rl/v2-m16-cargo-a/source","tree":"71571eeb60eeb0b6267e063dcdaa6ec704590102"}}
